Building DAG of jobs...
Using shell: /usr/bin/bash
Provided cores: 4
Rules claiming more threads will be scaled down.
Job stats:
job                     count
--------------------  -------
all                         1
blast_longest_contig        4
bowtie_index                1
build_index                 1
count_reads                 4
extract_cds                 1
final_report                1
kallisto_quant              4
longest_contig              4
mapping                     4
sleuth_analysis             1
spades_assembly             4
summarize_counts            1
total                      31

Select jobs to execute...

[Mon Feb 23 17:07:46 2026]
rule spades_assembly:
    input: Samples/SRR5660044_1_sample.fastq, Samples/SRR5660044_2_sample.fastq
    output: Outputs/SPADES/SRR5660044/transcripts.fasta
    jobid: 10
    reason: Missing output files: Outputs/SPADES/SRR5660044/transcripts.fasta
    wildcards: sample=SRR5660044
    resources: tmpdir=/tmp

spades.py --only-assembler -k 127 --rna -1 Samples/SRR5660044_1_sample.fastq -2 Samples/SRR5660044_2_sample.fastq -o Outputs/SPADES/SRR5660044

[Mon Feb 23 17:07:46 2026]
rule spades_assembly:
    input: Samples/SRR5660045_1_sample.fastq, Samples/SRR5660045_2_sample.fastq
    output: Outputs/SPADES/SRR5660045/transcripts.fasta
    jobid: 13
    reason: Missing output files: Outputs/SPADES/SRR5660045/transcripts.fasta
    wildcards: sample=SRR5660045
    resources: tmpdir=/tmp

spades.py --only-assembler -k 127 --rna -1 Samples/SRR5660045_1_sample.fastq -2 Samples/SRR5660045_2_sample.fastq -o Outputs/SPADES/SRR5660045

[Mon Feb 23 17:07:46 2026]
rule spades_assembly:
    input: Samples/SRR5660030_1_sample.fastq, Samples/SRR5660030_2_sample.fastq
    output: Outputs/SPADES/SRR5660030/transcripts.fasta
    jobid: 4
    reason: Missing output files: Outputs/SPADES/SRR5660030/transcripts.fasta
    wildcards: sample=SRR5660030
    resources: tmpdir=/tmp

spades.py --only-assembler -k 127 --rna -1 Samples/SRR5660030_1_sample.fastq -2 Samples/SRR5660030_2_sample.fastq -o Outputs/SPADES/SRR5660030

[Mon Feb 23 17:07:46 2026]
rule extract_cds:
    input: Samples/GCF_000845245.1/genomic.fna, Samples/GCF_000845245.1/genomic.gff
    output: Outputs/CDS/hcmv_cds.fasta, Outputs/cds_count.txt
    jobid: 14
    reason: Missing output files: Outputs/cds_count.txt, Outputs/CDS/hcmv_cds.fasta
    resources: tmpdir=/tmp

python Code/extract_cds.py -i Samples/GCF_000845245.1/genomic.fna -a Samples/GCF_000845245.1/genomic.gff -o Outputs/CDS/hcmv_cds.fasta -c Outputs/cds_count.txt
[Mon Feb 23 17:07:46 2026]
Finished job 14.
1 of 31 steps (3%) done
Select jobs to execute...

[Mon Feb 23 17:07:46 2026]
rule spades_assembly:
    input: Samples/SRR5660033_1_sample.fastq, Samples/SRR5660033_2_sample.fastq
    output: Outputs/SPADES/SRR5660033/transcripts.fasta
    jobid: 7
    reason: Missing output files: Outputs/SPADES/SRR5660033/transcripts.fasta
    wildcards: sample=SRR5660033
    resources: tmpdir=/tmp

spades.py --only-assembler -k 127 --rna -1 Samples/SRR5660033_1_sample.fastq -2 Samples/SRR5660033_2_sample.fastq -o Outputs/SPADES/SRR5660033
[Mon Feb 23 17:07:49 2026]
Finished job 13.
2 of 31 steps (6%) done
Select jobs to execute...

[Mon Feb 23 17:07:49 2026]
rule bowtie_index:
    input: Samples/GCF_000845245.1/genomic.fna
    output: Outputs/Bowtie/hcmv.1.bt2, Outputs/Bowtie/hcmv.2.bt2, Outputs/Bowtie/hcmv.3.bt2, Outputs/Bowtie/hcmv.4.bt2, Outputs/Bowtie/hcmv.rev.1.bt2, Outputs/Bowtie/hcmv.rev.2.bt2
    jobid: 22
    reason: Missing output files: Outputs/Bowtie/hcmv.rev.1.bt2, Outputs/Bowtie/hcmv.2.bt2, Outputs/Bowtie/hcmv.3.bt2, Outputs/Bowtie/hcmv.rev.2.bt2, Outputs/Bowtie/hcmv.1.bt2, Outputs/Bowtie/hcmv.4.bt2
    resources: tmpdir=/tmp


        mkdir -p Outputs/Bowtie
        bowtie2-build Samples/GCF_000845245.1/genomic.fna Outputs/Bowtie/hcmv
[Mon Feb 23 17:07:50 2026]
Finished job 4.
3 of 31 steps (10%) done
Select jobs to execute...

[Mon Feb 23 17:07:50 2026]
rule longest_contig:
    input: Outputs/SPADES/SRR5660030/transcripts.fasta
    output: Outputs/Longest_Contig/SRR5660030.fasta
    jobid: 3
    reason: Missing output files: Outputs/Longest_Contig/SRR5660030.fasta; Input files updated by another job: Outputs/SPADES/SRR5660030/transcripts.fasta
    wildcards: sample=SRR5660030
    resources: tmpdir=/tmp

mkdir -p Outputs/Longest_Contig
        python Code/longest_contig.py Outputs/SPADES/SRR5660030/transcripts.fasta Outputs/Longest_Contig/SRR5660030.fasta
[Mon Feb 23 17:07:50 2026]
Finished job 22.
4 of 31 steps (13%) done
Select jobs to execute...

[Mon Feb 23 17:07:50 2026]
rule mapping:
    input: Outputs/Bowtie/hcmv.1.bt2, Outputs/Bowtie/hcmv.2.bt2, Outputs/Bowtie/hcmv.3.bt2, Outputs/Bowtie/hcmv.4.bt2, Outputs/Bowtie/hcmv.rev.1.bt2, Outputs/Bowtie/hcmv.rev.2.bt2, Samples/SRR5660030_1_sample.fastq, Samples/SRR5660030_2_sample.fastq
    output: Outputs/Mapping/SRR5660030.bam
    jobid: 21
    reason: Missing output files: Outputs/Mapping/SRR5660030.bam; Input files updated by another job: Outputs/Bowtie/hcmv.rev.1.bt2, Outputs/Bowtie/hcmv.4.bt2, Outputs/Bowtie/hcmv.3.bt2, Outputs/Bowtie/hcmv.rev.2.bt2, Outputs/Bowtie/hcmv.1.bt2, Outputs/Bowtie/hcmv.2.bt2
    wildcards: sample=SRR5660030
    resources: tmpdir=/tmp

mkdir -p Outputs/Mapping
        bowtie2 -x Outputs/Bowtie/hcmv -1 Samples/SRR5660030_1_sample.fastq -2 Samples/SRR5660030_2_sample.fastq | samtools view -bS - > Outputs/Mapping/SRR5660030.bam
[Mon Feb 23 17:07:50 2026]
Finished job 3.
5 of 31 steps (16%) done
Select jobs to execute...

[Mon Feb 23 17:07:50 2026]
rule blast_longest_contig:
    input: Outputs/Longest_Contig/SRR5660030.fasta, Outputs/BLAST/stuff/genome.nhr, Outputs/BLAST/stuff/genome.nin, Outputs/BLAST/stuff/genome.nsq
    output: Outputs/BLAST/SRR5660030.blast.txt, Outputs/Temp/blast_SRR5660030.done
    jobid: 2
    reason: Missing output files: Outputs/BLAST/SRR5660030.blast.txt; Input files updated by another job: Outputs/Longest_Contig/SRR5660030.fasta
    wildcards: sample=SRR5660030
    resources: tmpdir=/tmp

mkdir -p Outputs/BLAST
        echo "SRR5660030:" > Outputs/BLAST/SRR5660030.blast.txt
        echo -e "sacc	pident	length	qstart	qend	sstart	send	bitscore	evalue	stitle" >> Outputs/BLAST/SRR5660030.blast.txt
        blastn -query Outputs/Longest_Contig/SRR5660030.fasta -db Outputs/BLAST/stuff/genome -max_hsps 1 -max_target_seqs 5 -outfmt "6 sacc pident length qstart qend sstart send bitscore evalue stitle" >> Outputs/BLAST/SRR5660030.blast.txt
        echo "" >> Outputs/BLAST/SRR5660030.blast.txt
        touch Outputs/Temp/blast_SRR5660030.done
[Mon Feb 23 17:07:50 2026]
Finished job 2.
6 of 31 steps (19%) done
Select jobs to execute...

[Mon Feb 23 17:07:50 2026]
rule build_index:
    input: Outputs/CDS/hcmv_cds.fasta
    output: Outputs/CDS/hcmv.idx
    jobid: 15
    reason: Missing output files: Outputs/CDS/hcmv.idx; Input files updated by another job: Outputs/CDS/hcmv_cds.fasta
    resources: tmpdir=/tmp

mkdir -p Outputs/CDS
        kallisto index --make-unique -i Outputs/CDS/hcmv.idx Outputs/CDS/hcmv_cds.fasta
[Mon Feb 23 17:07:50 2026]
Finished job 7.
7 of 31 steps (23%) done
Select jobs to execute...

[Mon Feb 23 17:07:50 2026]
rule mapping:
    input: Outputs/Bowtie/hcmv.1.bt2, Outputs/Bowtie/hcmv.2.bt2, Outputs/Bowtie/hcmv.3.bt2, Outputs/Bowtie/hcmv.4.bt2, Outputs/Bowtie/hcmv.rev.1.bt2, Outputs/Bowtie/hcmv.rev.2.bt2, Samples/SRR5660033_1_sample.fastq, Samples/SRR5660033_2_sample.fastq
    output: Outputs/Mapping/SRR5660033.bam
    jobid: 23
    reason: Missing output files: Outputs/Mapping/SRR5660033.bam; Input files updated by another job: Outputs/Bowtie/hcmv.rev.1.bt2, Outputs/Bowtie/hcmv.4.bt2, Outputs/Bowtie/hcmv.3.bt2, Outputs/Bowtie/hcmv.rev.2.bt2, Outputs/Bowtie/hcmv.1.bt2, Outputs/Bowtie/hcmv.2.bt2
    wildcards: sample=SRR5660033
    resources: tmpdir=/tmp

mkdir -p Outputs/Mapping
        bowtie2 -x Outputs/Bowtie/hcmv -1 Samples/SRR5660033_1_sample.fastq -2 Samples/SRR5660033_2_sample.fastq | samtools view -bS - > Outputs/Mapping/SRR5660033.bam
[Mon Feb 23 17:07:50 2026]
Finished job 10.
8 of 31 steps (26%) done
Select jobs to execute...

[Mon Feb 23 17:07:50 2026]
rule longest_contig:
    input: Outputs/SPADES/SRR5660044/transcripts.fasta
    output: Outputs/Longest_Contig/SRR5660044.fasta
    jobid: 9
    reason: Missing output files: Outputs/Longest_Contig/SRR5660044.fasta; Input files updated by another job: Outputs/SPADES/SRR5660044/transcripts.fasta
    wildcards: sample=SRR5660044
    resources: tmpdir=/tmp

mkdir -p Outputs/Longest_Contig
        python Code/longest_contig.py Outputs/SPADES/SRR5660044/transcripts.fasta Outputs/Longest_Contig/SRR5660044.fasta
[Mon Feb 23 17:07:50 2026]
Finished job 9.
9 of 31 steps (29%) done
Select jobs to execute...

[Mon Feb 23 17:07:50 2026]
rule mapping:
    input: Outputs/Bowtie/hcmv.1.bt2, Outputs/Bowtie/hcmv.2.bt2, Outputs/Bowtie/hcmv.3.bt2, Outputs/Bowtie/hcmv.4.bt2, Outputs/Bowtie/hcmv.rev.1.bt2, Outputs/Bowtie/hcmv.rev.2.bt2, Samples/SRR5660044_1_sample.fastq, Samples/SRR5660044_2_sample.fastq
    output: Outputs/Mapping/SRR5660044.bam
    jobid: 24
    reason: Missing output files: Outputs/Mapping/SRR5660044.bam; Input files updated by another job: Outputs/Bowtie/hcmv.rev.1.bt2, Outputs/Bowtie/hcmv.4.bt2, Outputs/Bowtie/hcmv.3.bt2, Outputs/Bowtie/hcmv.rev.2.bt2, Outputs/Bowtie/hcmv.1.bt2, Outputs/Bowtie/hcmv.2.bt2
    wildcards: sample=SRR5660044
    resources: tmpdir=/tmp

mkdir -p Outputs/Mapping
        bowtie2 -x Outputs/Bowtie/hcmv -1 Samples/SRR5660044_1_sample.fastq -2 Samples/SRR5660044_2_sample.fastq | samtools view -bS - > Outputs/Mapping/SRR5660044.bam
[Mon Feb 23 17:07:51 2026]
Finished job 15.
10 of 31 steps (32%) done
Select jobs to execute...

[Mon Feb 23 17:07:51 2026]
rule kallisto_quant:
    input: Outputs/CDS/hcmv.idx, Samples/SRR5660045_1_sample.fastq, Samples/SRR5660045_2_sample.fastq
    output: Outputs/Kallisto/SRR5660045
    jobid: 19
    reason: Missing output files: Outputs/Kallisto/SRR5660045; Input files updated by another job: Outputs/CDS/hcmv.idx
    wildcards: sample=SRR5660045
    resources: tmpdir=/tmp

kallisto quant -i Outputs/CDS/hcmv.idx -o Outputs/Kallisto/SRR5660045 Samples/SRR5660045_1_sample.fastq Samples/SRR5660045_2_sample.fastq
[Mon Feb 23 17:07:52 2026]
Finished job 19.
11 of 31 steps (35%) done
Select jobs to execute...

[Mon Feb 23 17:07:52 2026]
rule kallisto_quant:
    input: Outputs/CDS/hcmv.idx, Samples/SRR5660030_1_sample.fastq, Samples/SRR5660030_2_sample.fastq
    output: Outputs/Kallisto/SRR5660030
    jobid: 16
    reason: Missing output files: Outputs/Kallisto/SRR5660030; Input files updated by another job: Outputs/CDS/hcmv.idx
    wildcards: sample=SRR5660030
    resources: tmpdir=/tmp

kallisto quant -i Outputs/CDS/hcmv.idx -o Outputs/Kallisto/SRR5660030 Samples/SRR5660030_1_sample.fastq Samples/SRR5660030_2_sample.fastq
[Mon Feb 23 17:07:52 2026]
Finished job 16.
12 of 31 steps (39%) done
Select jobs to execute...

[Mon Feb 23 17:07:52 2026]
rule mapping:
    input: Outputs/Bowtie/hcmv.1.bt2, Outputs/Bowtie/hcmv.2.bt2, Outputs/Bowtie/hcmv.3.bt2, Outputs/Bowtie/hcmv.4.bt2, Outputs/Bowtie/hcmv.rev.1.bt2, Outputs/Bowtie/hcmv.rev.2.bt2, Samples/SRR5660045_1_sample.fastq, Samples/SRR5660045_2_sample.fastq
    output: Outputs/Mapping/SRR5660045.bam
    jobid: 25
    reason: Missing output files: Outputs/Mapping/SRR5660045.bam; Input files updated by another job: Outputs/Bowtie/hcmv.rev.1.bt2, Outputs/Bowtie/hcmv.4.bt2, Outputs/Bowtie/hcmv.3.bt2, Outputs/Bowtie/hcmv.rev.2.bt2, Outputs/Bowtie/hcmv.1.bt2, Outputs/Bowtie/hcmv.2.bt2
    wildcards: sample=SRR5660045
    resources: tmpdir=/tmp

mkdir -p Outputs/Mapping
        bowtie2 -x Outputs/Bowtie/hcmv -1 Samples/SRR5660045_1_sample.fastq -2 Samples/SRR5660045_2_sample.fastq | samtools view -bS - > Outputs/Mapping/SRR5660045.bam
[Mon Feb 23 17:07:53 2026]
Finished job 23.
13 of 31 steps (42%) done
[Mon Feb 23 17:07:53 2026]
Finished job 21.
14 of 31 steps (45%) done
Select jobs to execute...

[Mon Feb 23 17:07:53 2026]
rule longest_contig:
    input: Outputs/SPADES/SRR5660045/transcripts.fasta
    output: Outputs/Longest_Contig/SRR5660045.fasta
    jobid: 12
    reason: Missing output files: Outputs/Longest_Contig/SRR5660045.fasta; Input files updated by another job: Outputs/SPADES/SRR5660045/transcripts.fasta
    wildcards: sample=SRR5660045
    resources: tmpdir=/tmp

mkdir -p Outputs/Longest_Contig
        python Code/longest_contig.py Outputs/SPADES/SRR5660045/transcripts.fasta Outputs/Longest_Contig/SRR5660045.fasta

[Mon Feb 23 17:07:53 2026]
rule kallisto_quant:
    input: Outputs/CDS/hcmv.idx, Samples/SRR5660044_1_sample.fastq, Samples/SRR5660044_2_sample.fastq
    output: Outputs/Kallisto/SRR5660044
    jobid: 18
    reason: Missing output files: Outputs/Kallisto/SRR5660044; Input files updated by another job: Outputs/CDS/hcmv.idx
    wildcards: sample=SRR5660044
    resources: tmpdir=/tmp

kallisto quant -i Outputs/CDS/hcmv.idx -o Outputs/Kallisto/SRR5660044 Samples/SRR5660044_1_sample.fastq Samples/SRR5660044_2_sample.fastq
Select jobs to execute...
[Mon Feb 23 17:07:53 2026]
Finished job 24.
15 of 31 steps (48%) done

[Mon Feb 23 17:07:54 2026]
rule count_reads:
    input: Outputs/Mapping/SRR5660033.bam, Samples/SRR5660033_1_sample.fastq
    output: Outputs/Temp/SRR5660033.count.txt
    jobid: 28
    reason: Missing output files: Outputs/Temp/SRR5660033.count.txt; Input files updated by another job: Outputs/Mapping/SRR5660033.bam
    wildcards: sample=SRR5660033
    resources: tmpdir=/tmp

python Code/count_reads.py Samples/SRR5660033_1_sample.fastq Outputs/Mapping/SRR5660033.bam SRR5660033 Outputs/Temp/SRR5660033.count.txt
[Mon Feb 23 17:07:54 2026]
Finished job 12.
16 of 31 steps (52%) done
Select jobs to execute...

[Mon Feb 23 17:07:54 2026]
rule count_reads:
    input: Outputs/Mapping/SRR5660030.bam, Samples/SRR5660030_1_sample.fastq
    output: Outputs/Temp/SRR5660030.count.txt
    jobid: 27
    reason: Missing output files: Outputs/Temp/SRR5660030.count.txt; Input files updated by another job: Outputs/Mapping/SRR5660030.bam
    wildcards: sample=SRR5660030
    resources: tmpdir=/tmp

python Code/count_reads.py Samples/SRR5660030_1_sample.fastq Outputs/Mapping/SRR5660030.bam SRR5660030 Outputs/Temp/SRR5660030.count.txt
[Mon Feb 23 17:07:54 2026]
Finished job 28.
17 of 31 steps (55%) done
Select jobs to execute...

[Mon Feb 23 17:07:54 2026]
rule blast_longest_contig:
    input: Outputs/Longest_Contig/SRR5660045.fasta, Outputs/BLAST/stuff/genome.nhr, Outputs/BLAST/stuff/genome.nin, Outputs/BLAST/stuff/genome.nsq
    output: Outputs/BLAST/SRR5660045.blast.txt, Outputs/Temp/blast_SRR5660045.done
    jobid: 11
    reason: Missing output files: Outputs/BLAST/SRR5660045.blast.txt; Input files updated by another job: Outputs/Longest_Contig/SRR5660045.fasta
    wildcards: sample=SRR5660045
    resources: tmpdir=/tmp

mkdir -p Outputs/BLAST
        echo "SRR5660045:" > Outputs/BLAST/SRR5660045.blast.txt
        echo -e "sacc	pident	length	qstart	qend	sstart	send	bitscore	evalue	stitle" >> Outputs/BLAST/SRR5660045.blast.txt
        blastn -query Outputs/Longest_Contig/SRR5660045.fasta -db Outputs/BLAST/stuff/genome -max_hsps 1 -max_target_seqs 5 -outfmt "6 sacc pident length qstart qend sstart send bitscore evalue stitle" >> Outputs/BLAST/SRR5660045.blast.txt
        echo "" >> Outputs/BLAST/SRR5660045.blast.txt
        touch Outputs/Temp/blast_SRR5660045.done
[Mon Feb 23 17:07:54 2026]
Finished job 27.
18 of 31 steps (58%) done
Select jobs to execute...

[Mon Feb 23 17:07:54 2026]
rule longest_contig:
    input: Outputs/SPADES/SRR5660033/transcripts.fasta
    output: Outputs/Longest_Contig/SRR5660033.fasta
    jobid: 6
    reason: Missing output files: Outputs/Longest_Contig/SRR5660033.fasta; Input files updated by another job: Outputs/SPADES/SRR5660033/transcripts.fasta
    wildcards: sample=SRR5660033
    resources: tmpdir=/tmp

mkdir -p Outputs/Longest_Contig
        python Code/longest_contig.py Outputs/SPADES/SRR5660033/transcripts.fasta Outputs/Longest_Contig/SRR5660033.fasta
[Mon Feb 23 17:07:54 2026]
Finished job 11.
19 of 31 steps (61%) done
Select jobs to execute...

[Mon Feb 23 17:07:54 2026]
rule count_reads:
    input: Outputs/Mapping/SRR5660044.bam, Samples/SRR5660044_1_sample.fastq
    output: Outputs/Temp/SRR5660044.count.txt
    jobid: 29
    reason: Missing output files: Outputs/Temp/SRR5660044.count.txt; Input files updated by another job: Outputs/Mapping/SRR5660044.bam
    wildcards: sample=SRR5660044
    resources: tmpdir=/tmp

python Code/count_reads.py Samples/SRR5660044_1_sample.fastq Outputs/Mapping/SRR5660044.bam SRR5660044 Outputs/Temp/SRR5660044.count.txt
[Mon Feb 23 17:07:54 2026]
Finished job 29.
20 of 31 steps (65%) done
Select jobs to execute...

[Mon Feb 23 17:07:54 2026]
rule kallisto_quant:
    input: Outputs/CDS/hcmv.idx, Samples/SRR5660033_1_sample.fastq, Samples/SRR5660033_2_sample.fastq
    output: Outputs/Kallisto/SRR5660033
    jobid: 17
    reason: Missing output files: Outputs/Kallisto/SRR5660033; Input files updated by another job: Outputs/CDS/hcmv.idx
    wildcards: sample=SRR5660033
    resources: tmpdir=/tmp

kallisto quant -i Outputs/CDS/hcmv.idx -o Outputs/Kallisto/SRR5660033 Samples/SRR5660033_1_sample.fastq Samples/SRR5660033_2_sample.fastq
[Mon Feb 23 17:07:54 2026]
Finished job 18.
21 of 31 steps (68%) done
Select jobs to execute...

[Mon Feb 23 17:07:54 2026]
rule blast_longest_contig:
    input: Outputs/Longest_Contig/SRR5660044.fasta, Outputs/BLAST/stuff/genome.nhr, Outputs/BLAST/stuff/genome.nin, Outputs/BLAST/stuff/genome.nsq
    output: Outputs/BLAST/SRR5660044.blast.txt, Outputs/Temp/blast_SRR5660044.done
    jobid: 8
    reason: Missing output files: Outputs/BLAST/SRR5660044.blast.txt; Input files updated by another job: Outputs/Longest_Contig/SRR5660044.fasta
    wildcards: sample=SRR5660044
    resources: tmpdir=/tmp

mkdir -p Outputs/BLAST
        echo "SRR5660044:" > Outputs/BLAST/SRR5660044.blast.txt
        echo -e "sacc	pident	length	qstart	qend	sstart	send	bitscore	evalue	stitle" >> Outputs/BLAST/SRR5660044.blast.txt
        blastn -query Outputs/Longest_Contig/SRR5660044.fasta -db Outputs/BLAST/stuff/genome -max_hsps 1 -max_target_seqs 5 -outfmt "6 sacc pident length qstart qend sstart send bitscore evalue stitle" >> Outputs/BLAST/SRR5660044.blast.txt
        echo "" >> Outputs/BLAST/SRR5660044.blast.txt
        touch Outputs/Temp/blast_SRR5660044.done
[Mon Feb 23 17:07:54 2026]
Finished job 6.
22 of 31 steps (71%) done
Select jobs to execute...

[Mon Feb 23 17:07:54 2026]
rule blast_longest_contig:
    input: Outputs/Longest_Contig/SRR5660033.fasta, Outputs/BLAST/stuff/genome.nhr, Outputs/BLAST/stuff/genome.nin, Outputs/BLAST/stuff/genome.nsq
    output: Outputs/BLAST/SRR5660033.blast.txt, Outputs/Temp/blast_SRR5660033.done
    jobid: 5
    reason: Missing output files: Outputs/BLAST/SRR5660033.blast.txt; Input files updated by another job: Outputs/Longest_Contig/SRR5660033.fasta
    wildcards: sample=SRR5660033
    resources: tmpdir=/tmp

mkdir -p Outputs/BLAST
        echo "SRR5660033:" > Outputs/BLAST/SRR5660033.blast.txt
        echo -e "sacc	pident	length	qstart	qend	sstart	send	bitscore	evalue	stitle" >> Outputs/BLAST/SRR5660033.blast.txt
        blastn -query Outputs/Longest_Contig/SRR5660033.fasta -db Outputs/BLAST/stuff/genome -max_hsps 1 -max_target_seqs 5 -outfmt "6 sacc pident length qstart qend sstart send bitscore evalue stitle" >> Outputs/BLAST/SRR5660033.blast.txt
        echo "" >> Outputs/BLAST/SRR5660033.blast.txt
        touch Outputs/Temp/blast_SRR5660033.done
[Mon Feb 23 17:07:54 2026]
Finished job 8.
23 of 31 steps (74%) done
[Mon Feb 23 17:07:54 2026]
Finished job 5.
24 of 31 steps (77%) done
Select jobs to execute...

[Mon Feb 23 17:07:54 2026]
rule final_report:
    input: Outputs/BLAST/SRR5660030.blast.txt, Outputs/BLAST/SRR5660033.blast.txt, Outputs/BLAST/SRR5660044.blast.txt, Outputs/BLAST/SRR5660045.blast.txt
    output: PipelineReport.txt
    jobid: 1
    reason: Missing output files: PipelineReport.txt; Input files updated by another job: Outputs/BLAST/SRR5660033.blast.txt, Outputs/BLAST/SRR5660044.blast.txt, Outputs/BLAST/SRR5660045.blast.txt, Outputs/BLAST/SRR5660030.blast.txt
    resources: tmpdir=/tmp


        cat Outputs/BLAST/SRR5660030.blast.txt Outputs/BLAST/SRR5660033.blast.txt Outputs/BLAST/SRR5660044.blast.txt Outputs/BLAST/SRR5660045.blast.txt > PipelineReport.txt
        
[Mon Feb 23 17:07:54 2026]
Finished job 1.
25 of 31 steps (81%) done
[Mon Feb 23 17:07:55 2026]
Finished job 17.
26 of 31 steps (84%) done
Select jobs to execute...

[Mon Feb 23 17:07:55 2026]
rule sleuth_analysis:
    input: Outputs/Kallisto/SRR5660030, Outputs/Kallisto/SRR5660033, Outputs/Kallisto/SRR5660044, Outputs/Kallisto/SRR5660045, Code/sleuth_code.R
    output: Outputs/Kallisto/sleuth.txt
    jobid: 20
    reason: Missing output files: Outputs/Kallisto/sleuth.txt; Input files updated by another job: Outputs/Kallisto/SRR5660033, Outputs/Kallisto/SRR5660044, Outputs/Kallisto/SRR5660030, Outputs/Kallisto/SRR5660045
    resources: tmpdir=/tmp

Rscript Code/sleuth_code.R > Outputs/Kallisto/sleuth.txt 2>&1
[Mon Feb 23 17:07:55 2026]
Finished job 25.
27 of 31 steps (87%) done
Select jobs to execute...

[Mon Feb 23 17:07:55 2026]
rule count_reads:
    input: Outputs/Mapping/SRR5660045.bam, Samples/SRR5660045_1_sample.fastq
    output: Outputs/Temp/SRR5660045.count.txt
    jobid: 30
    reason: Missing output files: Outputs/Temp/SRR5660045.count.txt; Input files updated by another job: Outputs/Mapping/SRR5660045.bam
    wildcards: sample=SRR5660045
    resources: tmpdir=/tmp

python Code/count_reads.py Samples/SRR5660045_1_sample.fastq Outputs/Mapping/SRR5660045.bam SRR5660045 Outputs/Temp/SRR5660045.count.txt
[Mon Feb 23 17:07:55 2026]
Finished job 30.
28 of 31 steps (90%) done
Select jobs to execute...

[Mon Feb 23 17:07:55 2026]
rule summarize_counts:
    input: Outputs/Temp/SRR5660030.count.txt, Outputs/Temp/SRR5660033.count.txt, Outputs/Temp/SRR5660044.count.txt, Outputs/Temp/SRR5660045.count.txt
    output: Outputs/Temp/count_reads_summary.txt
    jobid: 26
    reason: Missing output files: Outputs/Temp/count_reads_summary.txt; Input files updated by another job: Outputs/Temp/SRR5660045.count.txt, Outputs/Temp/SRR5660033.count.txt, Outputs/Temp/SRR5660044.count.txt, Outputs/Temp/SRR5660030.count.txt
    resources: tmpdir=/tmp

cat Outputs/Temp/SRR5660030.count.txt Outputs/Temp/SRR5660033.count.txt Outputs/Temp/SRR5660044.count.txt Outputs/Temp/SRR5660045.count.txt>Outputs/Temp/count_reads_summary.txt
[Mon Feb 23 17:07:55 2026]
Finished job 26.
29 of 31 steps (94%) done
[Mon Feb 23 17:07:56 2026]
Error in rule sleuth_analysis:
    jobid: 20
    input: Outputs/Kallisto/SRR5660030, Outputs/Kallisto/SRR5660033, Outputs/Kallisto/SRR5660044, Outputs/Kallisto/SRR5660045, Code/sleuth_code.R
    output: Outputs/Kallisto/sleuth.txt
    shell:
        Rscript Code/sleuth_code.R > Outputs/Kallisto/sleuth.txt 2>&1
        (one of the commands exited with non-zero exit code; note that snakemake uses bash strict mode!)

Removing output files of failed job sleuth_analysis since they might be corrupted:
Outputs/Kallisto/sleuth.txt
Shutting down, this might take some time.
Exiting because a job execution failed. Look above for error message
Complete log: .snakemake/log/2026-02-23T170745.398261.snakemake.log
